{
  "schema_version": 1,
  "subject": "g8_m37_streaming_io",
  "symbolic_gate_key": "g8.p0.m37.streaming_io",
  "matrix_row": "M37",
  "wave": "G8.4",
  "numeric_step": 112,
  "source_ref": "G8_ACCEPTANCE_MAP §2 M37;G8.3_G8.4_ASSET_STREAMING_DESIGN §4.1;RFC-0019 §4.8.3 queue_mode=single",
  "host_section_pass": true,
  "device_section_state": "pass",
  "queue_mode": "single",
  "checks": {
    "real_disk_file_read": true,
    "per_page_stage_order_monotonic": true,
    "decompress_via_frozen_decoder": true,
    "final_device_digest_equals_golden": true,
    "late_page_fallback_frame_present": true,
    "late_page_recovers_correct": true,
    "fault_injection_deterministic": true,
    "budgets_metered": true,
    "queue_mode_single_registered": true,
    "device_validation_zero": true
  },
  "evidence_level": "measured_local",
  "run_url": "",
  "timestamp": "20260808T030730Z",
  "environment": {
    "os": "Windows-11-10.0.28120-SP0",
    "python_version": "3.12.1",
    "cargo_version": "cargo 1.93.1 (083ac5135 2025-12-15)",
    "rustc_version": "rustc 1.93.1 (01f6ddf75 2026-02-11)"
  },
  "notes": "golden=H:\\rurix\\tests\\geom_pages\\golden\\m04_page0.rxpd; fallback=2 recovered=True digest=3745148867 io=7627"
}
